,ID,WRITER,CONTENT,TYPE,SCORE,CREATED_AT,len_content
16810,CONT_000000000500384,유진,주말에 가니 대기가 너무 길어 예약해놓고 선녀탕다녀왔습니다대기하고 대기하고 또 대기해야하지만 새로운 경험이어 즐거웠습니다대기만 없다면 다시 오고싶습니다,kakao,5.0,21.06.30.,84
16772,CONT_000000000500384,맛집만 가는 사람,내가 제주도에서 좋아하는 곳 중에 한 곳임검은 모래에 강물과 바다가 만나는 곳이라 그런지 더 좋았음물 먹어봤는데 바다쪽은 짜고 강쪽은 안짠게 신기함,kakao,5.0,22.11.28.,82
16771,CONT_000000000500384,전쑨대,제주에서 제일 좋아하는 곳 그냥 벤치에 앉아 보고만 있어도 제주스럽고 그냥 제주를 쇠소깍 하나로 다 보여주는 느낌 무튼 너무 좋다,kakao,5.0,22.11.29.,72
16823,CONT_000000000500384,ㅇㅇ,물 많이 찼을때 가면 좋을듯해요나룻배는 직접 노를 저어 갈수 있어서 재밌고 테우는 설명을 들으면서 탈 수 있어서 좋아요,kakao,5.0,21.04.07.,66
16822,CONT_000000000500384,답장,제주도 날씨요정에게 축복을 받으셨다면무조건 갔다오세요 날씨에 따라 평가가 달라질듯한 장소 입니다,kakao,5.0,21.04.08.,53
16791,CONT_000000000500384,탑,날이 좋아야함 날이 흐린날 갔더니 물이 칙칙 ㅠㅠ 해가 쨍쨍한날 가야 에메랄드색감 나옵니다,kakao,5.0,22.04.21.,50
16853,CONT_000000000500384,주원,물색이 사기에요ㅜㅠ 보트 타지는 못했지만 지켜보는 것만으로 행복했습니다,kakao,5.0,19.12.11.,39
16803,CONT_000000000500384,♥,타고 있는 사람이 워낙 많아서 카약은 따로 안탔지만 물이 엄청 맑아요,kakao,5.0,21.11.05.,38
16832,CONT_000000000500384,안현수,맑은 물과 뛰어난 경관속에 뱃놀이 아이들이 너무 좋아했습니다,kakao,5.0,20.11.23.,33
16849,CONT_000000000500384,별나,경치가 아주 예뻐서 할머니를 포함한 가족들이 좋아했어요,kakao,5.0,20.03.03.,30
16795,CONT_000000000500384,박민수,쇠소깍지 랑이어진  바다 풍경이 이뻐요등대도 개있고,kakao,5.0,22.03.16.,28
16868,CONT_000000000500384,Andy,입장료 없고 무료주차 경치 좋고 검은 모래 특이함,kakao,5.0,18.05.08.,27
16836,CONT_000000000500384,ㅇ,카약 타고 한바퀴돌고 넘나 좋아효모래알 검은모레,kakao,5.0,20.10.21.,26
16845,CONT_000000000500384,geoff,깡통열차 너무 재밌어요 꼭 제일 뒤에 타세요,kakao,5.0,20.06.06.,24
16855,CONT_000000000500384,깜,해수와 담수가 만나 환상의 경계를 이루는 곳,kakao,5.0,19.11.24.,24
16770,CONT_000000000500384,달제리,너무 예뻐요 마치 선녀가 있을것 같은 공간,kakao,5.0,22.12.27.,23
16824,CONT_000000000500384,ms,정말 사진으로는 다 담을수없을정도로 이쁨,kakao,5.0,21.03.10.,22
16804,CONT_000000000500384,hongkiss,비와서 물은 흐렸지만 멋진 경치입니다,kakao,5.0,21.09.21.,20
16848,CONT_000000000500384,지나,여름에 투명보트 타보러 와야겠어요,kakao,5.0,20.03.29.,18
16827,CONT_000000000500384,좋은거만 후기씀,지나가는 길에 카약 타기 좋아요,kakao,5.0,21.02.13.,17
16854,CONT_000000000500384,콩콩,물색보고 놀랬어요 너무이뻤어요,kakao,5.0,19.12.09.,16
16815,CONT_000000000500384,쭈,또 가고싶은곳 ㅎㅎ,kakao,5.0,21.05.17.,10
16773,CONT_000000000500384,chan kim,카약을 꼭 타세요,kakao,5.0,22.11.26.,9
16774,CONT_000000000500384,skk,풍경너무좋음,kakao,5.0,22.11.02.,6
16778,CONT_000000000500384,감자,진짜 이쁨,kakao,5.0,22.09.07.,5
16777,CONT_000000000500384,flow, ,kakao,5.0,22.10.02.,1
16780,CONT_000000000500384,"Song, Sang-Ho", ,kakao,5.0,22.08.09.,1
16786,CONT_000000000500384,열혈마, ,kakao,5.0,22.07.02.,1
16796,CONT_000000000500384,훔, ,kakao,5.0,22.02.23.,1
16798,CONT_000000000500384,🥰, ,kakao,5.0,22.01.18.,1
16799,CONT_000000000500384,윤자영, ,kakao,5.0,22.01.08.,1
16800,CONT_000000000500384,최승목/크로바통신, ,kakao,5.0,21.12.06.,1
13589,CONT_000000000500379,슈타인,진지동굴은 육지쪽 해안가쪽 모두 있음 해안가쪽은 태평양전쟁당시 미군이 상륙할 것을 대비해 작은 보트를 숨겨뒀다가 대형함정이 다가오면 몰래 다가가 자살폭탄공격을 하기위한 소형 보트와 폭탄을 숨기기 위해 만들어 진것으로 추청됨 낙석위험으로 폐쇄조치 되었습니다,kakao,5.0,21.05.17.,142
13597,CONT_000000000500379,상곰,난 이 밑에 분이 동굴 어떻게 들어갔는지 궁금하드라못 들어가는 곳 이구나 생각하고 직접 가봤는데 아예 가볼수가 없고 바라볼수밖에 없는 곳임,kakao,5.0,20.07.01.,77
13588,CONT_000000000500379,솔직담백리뷰,해안가에만 있지 않고 송악산 둘레길 중간중간 있습니다 해안가에 았는 동굴은 접근 금지상태였어요,kakao,5.0,22.10.14.,52
13594,CONT_000000000500379,먹는게남는거,산방산 전망대 가기전 잠깐 구경하는 곳 차대전때문에 제주도가 많이 아파했던 곳,kakao,5.0,20.09.17.,43
13592,CONT_000000000500379,만두콩,해질녘에 가면 절경이 멋져요 기분이 요상하네요 다크투어리즘,kakao,5.0,21.01.01.,32
13598,CONT_000000000500379,유지퉤,붕괴의 위험이 있으니 출입하지 마시오그러나 최고입니다,kakao,5.0,20.04.10.,29
13590,CONT_000000000500379,ssss_real,현재 동굴진지 전면 폐쇄조치 되었습니다 참고하세요,kakao,5.0,21.03.31.,27
13595,CONT_000000000500379,지훈,출입 금지,kakao,5.0,20.09.12.,5
13591,CONT_000000000500379,석원, ,kakao,5.0,21.01.13.,1
13596,CONT_000000000500379,호,둘이 산책하기 좋음,kakao,4.0,20.08.11.,10
13593,CONT_000000000500379,깜,천혜의 자연에 이런 짓을왜놈들은 박멸이 답이다,kakao,1.0,20.10.20.,25
19954,CONT_000000000500378,neud, 입구출구 코스보다 출구입구 역행하는 코스가 더 예쁠듯하다 ㅠ 바다보면서 걸을 수 있을듯 산방산형제섬한라산해안절벽가파도마라도검은해변 까지 다양한 경치가 끊임없어 펼쳐져 지루함을 느낄 틈이 없음 코스가 나무데크로 아주 잘 다져져있음 걷기도 편하고 나무데크라 사진찍어도 자연과 어우러져 정말 예쁨 새파란 바다와 뭉게구름 푸르른 하늘 초록의 제주식물들의 조화가 미쳤음 군데군데 긴 풀들이 마구 자라있는데 얘네가 거친 바다바람에 휘날리는게 의외의 장관 포인트 몇분동안 멍하니 풀 흩날리는거 구경함 수국야자수바다의 조화는     일듯 말이 왜 거기서 나와 안 갈 이유가 없는 곳,kakao,5.0,21.07.17.,318
20025,CONT_000000000500378,Ryu용환,제주 올레길 코스 송악산 산책길 타라 가시면 형제섬과 산방산을 뒤로하고 우측으로 산쪽으로 먼저 오르시기를 ㅋ 첫번째 고지에 올라서 산방산과 형제섬을 보는 비경이 너무 아름답습니다정상이 얼마 남지 않은 길 정상에 오르면 송악산 표지석 멀리 산방산이 더 아름답게 펼쳐지고 뒷쪽으로 작은섬과 큰 섬이 보이는데 작은 섬이 마라도인고 큰 섬은 가파도입니다그리고 분화구를 한 눈에내려가면 해안쪽으로 가시면 모슬포해안의 비경을 즐길수 있습니다 해안쪽으로 먼저 가시면 마지막에 송악산을 올라감으로 힘듭니다반드시 송악산으로 먼저 가시길,kakao,5.0,16.11.28.,290
19904,CONT_000000000500378,1122,송악산 미터 짜리 언덕에 불과한데 별거 있겠어 라는 생각으로 년동안 한번도 안가봤었는데 오늘 가보고 제 착각이었다는 걸 알았습니다 언덕 하나 달랑 있는 곳이 아니라 섭지코지와 비슷한 넓은 곳에 둘레길이 있어 산방산과 가파도에 이르는 넓은 경치를 한눈에 감상할 수 있습니다,kakao,5.0,22.12.14.,151
19956,CONT_000000000500378,Drew89,경치가 정말 아름다워요 게다가 송악산 관광객분들이 매우 정직하고 착해요 핸드폰을 송악산에 있는 정자에 두가 가버렸기 때문에 온가족이 걱정을 하고 있어요 그런데 시간 정도 지나가고 다시 돌아오다가 핸드폰 그대로 있었어요  그 동안 핸드폰을 두신 분들께 정말 감사드립니다,kakao,5.0,21.06.26.,149
19978,CONT_000000000500378,김보람,바람이 정말정말 많이 불긴 하지만이번 제주 여행에서 가장 기억에 남을 곳날씨도 한몫하긴 했지만 ㅠㅠ사진 찍고 구경하면서 한바퀴 돌면 한시간 좀 넘게 넉넉하게 한시간 반 정도 걸리고둘레길이어서 길이 험하지 않아 가볍게 다녀오기 좋습니다노을질때 또 가보고 싶네요,kakao,5.0,20.11.27.,144
19926,CONT_000000000500378,끌림,송악산 주차장에서 출발하여 둘레길을 한바퀴 돌아보기를 권합니다  동에서 남을 지나 서로 나오는 둘레길을 걷다보면 몸과 마음이 정화되는 느낌을 받을 수 있을 겁니다 송악산 앞바다 바다거북이  송악산 들 꽃  둘레길  가파도와 마라도  산방산과 형제섬 ,kakao,5.0,22.08.11.,139
20007,CONT_000000000500378,한승훈 paco,날씨가 매우 흐렸음에도 걷는데 절벽의 곡선 산의 곡선이 너무 아름다웠습니다 천천히 걸으면 한시간 정도 걷는데 매우 만족도가 좋았습니다 꼭 다시 오고 싶네요 다만 제 인가 전망대 옆 회집인가는 좀 경치를 깨네요 날씨 좋을 때 오면 정말 멋질듯하네요,kakao,5.0,19.07.30.,137
19899,CONT_000000000500378,ㅣㅜㅎ,둘레길은 간단히 걷기 좋아서 어른들 모시고 오신분들은 둘레길 추천 드리고 젊은 분들은 시간이나 체력 되시면 정상 한 번 가보는거 추천 드려요 정상에서 보는 풍경 황홀해요 그리고 분화구도 신기하구요 올라갈 땐 조금 힘들지만 그만한 보상이 있답니다,kakao,5.0,23.02.04.,136
19945,CONT_000000000500378,KANG,꼭 산 정상이 아니라 근처 둘레길로만 다녀와도 충분히 만족스러운 뷰를 감상할 수 있습니다 왕복 시간 정도면 충분히 다녀올 수 있고 날씨 좋은 날 바라보는 마라도랑 산방산 뷰가 일품이였습니다 등산에 취미가 없어도 가벼운 마음으로 걸어보세요,kakao,5.0,21.11.03.,132
19996,CONT_000000000500378,상곰,카카오맵 글을 보고 오고 나서 평가좋았던 점 예쁜 산책로를 제공하는 곳이며 걷다보면 마라도 산방산 등등 여러가지 자연 풍경이 장관이다하이힐을 신었거나 걷기 싫어하는 사람은 오지말 것입장료 없고 자연이 너무 이쁜곳,kakao,5.0,20.07.01.,118
20029,CONT_000000000500378,박진현,제주 서남부 오름 올레길로 해안만 보는 것보다 정상까지 올라가보면 좋다 북동부와는 달리 남부의 바다는 외해라 아름다움도 느끼지만 그보다 끝없이 펼쳐진 바다에 대해 경외감과 두려움을 느끼게 된다 바람이 정말 세다,kakao,5.0,16.03.16.,117
19988,CONT_000000000500378,uwagi,오르막없이 걷기 너무좋아요 말타는곳 두군데 천원 첫번째 건너뛰고 두번째 할아버지께서 하시는곳에서 엄청 크게 노래하시며 길게 돌아주세요 말한테 미안해서 저학년 한명 탔습니다 풍경도 좋코 또 가고파요,kakao,5.0,20.10.19.,109
19925,CONT_000000000500378,do,정상 분화구 근처까지 올라가면 믿을수없을 만큼 상쾌한 바람이 끊임없이 불어옴 버스접근성 좋고 마라도 가는길에 묶어서 가기좋고 조망권이 상당히 훌륭하며 정상부근 말고는 경사가 없다시피 한 편,kakao,5.0,22.08.16.,105
19949,CONT_000000000500378,삐비삑,슥 가던 송악산을 아주그냥 쭉 돌았구요길도 이쁘게 잘만들어서 편히 올라갈수있어습니다 길따라쭉가니말들이 자유롭게 풀뜯고요바다와 마라도는 역시 잘있구요부모님도 쉬이 갈수있는길 같아요,kakao,5.0,21.09.04.,99
19937,CONT_000000000500378,루와젠,산이 높지 않아서 적당히 산책하러 갈 때 정말 좋은 것 같아요 날이 좋을 땐 가파도랑 마라도도 잘 보여서 좋았어요 근데 유채꽃밭이 있다고 들었는데 그건 어딨는지 모르겠어요ㅠ,kakao,5.0,22.01.18.,96
19964,CONT_000000000500378,폴,제주 야생화 볼 수 있습니다 새벽녘 사람 읍이 한바퀴 돌고 오세요 피톤치드 가득한 풀냄새도 좋고 이어폰은 잠시 넣어두고 음악소리 대신 새소리 들어보세요 운동화는 필수입니다,kakao,5.0,21.05.12.,95
19928,CONT_000000000500378,ㅅㅊ,송악산 한라산마라도 가파도 다 볼수있고 높지않아서둘레길로 한바퀴 돌 수있어 좋음 중간에 말이 바로 앞까지 있어서 신기할 정도밑에 사람 왜 제주도 명소 다 별점테러하는지,kakao,5.0,22.06.06.,93
20018,CONT_000000000500378,미야옹,굉장히 상쾌하게 바람 맞으며 보는데 참 좋아요약간 단점이라면 코스길이가 꽤 되서 약간 지칠 순 있어요그리고 월까지 정상로는 통제한다고 하네요 참고하세요,kakao,5.0,18.12.19.,84
19965,CONT_000000000500378,shin,의외로 제주도에 애견동반 안되는 곳이 많으데 강아지 산책하기 너무너무 좋습니다진드기 걱정도 없구요 여러분 두번가세요 사진은 발로 찍어도 잘나와요,kakao,5.0,21.05.11.,80
19930,CONT_000000000500378,미래,제주도에서 볼 수 있는 뷰가 참 멋진곳 시원하니 참 좋습니다 속이 뻥뚤리는 기분 말들도 풀뜯고 있어서 신기해요ㅋㅋ 역시 제주도,kakao,5.0,22.05.31.,70
19905,CONT_000000000500378,나무그림자,송악산 정상은 안가고 둘레길 따라 바다보며 한바퀴 돌았어요 산책하기 너무 좋았네요 산방산 잘 보이고 뷰가 정말 끝내줬어요,kakao,5.0,22.12.13.,67
19947,CONT_000000000500378,은아짱,한 시간 정도면 일부개방된 정상포함해서 둘레길 한바퀴 충분히 둘러볼 수 있어요 바람 많이 부는날 빼곤 언제나 가기좋아요,kakao,5.0,21.09.21.,66
20021,CONT_000000000500378,별,둘레길 최고 한바퀴도는거 한시간 반정도 걸린거같아요건너편 산방산도 나오고 마라도도 보이고경치가 진짜 감탄받았어요,kakao,5.0,18.07.23.,62
19912,CONT_000000000500378,개인차 존중필요;이해된다 안된다 놉,제주도는 송악산둘레길이쁜곳 많죠 근데 가슴이 웅장해 지는 곳은 별로 없죠이 좋은곳을 그동안 왜 안갔지강 추,kakao,5.0,22.10.28.,59
20023,CONT_000000000500378,수발,제주도 최고의 힐링이였어요 송악산 한담해변을 최고로 꼽겠어요 한가로운 아름다움 제주특유의 분위기 만끽했어요,kakao,5.0,18.03.28.,59
19909,CONT_000000000500378,음하하,아주 훌륭합니다 찾아올만해요 개발을 안하고 보존된 느낌이어서 더 좋았어요 반드시 끝 전망대까지 가보세요,kakao,5.0,22.11.20.,57
19966,CONT_000000000500378,;_;,해질 때 갔는데너무 예뻐서 눈물이 났어요바람 심하지 않았고너무 예뻐서 내일 다시 와야할지 고민 중이에여,kakao,5.0,21.04.20.,57
19914,CONT_000000000500378,솔직담백리뷰,가볍게 산책하기 좋음 둘레길 끝에서 바라보는 서귀포 광경이 좋음 다만 사람이 너무 많음 주차가 어려움,kakao,5.0,22.10.14.,56
19907,CONT_000000000500378,장주용,여기 꼭 와보셔야 하는 곳이에요 상대적으로 덜 알려진 곳 같은데 제주도 최남단이고 뷰가 너무 좋아요,kakao,5.0,22.12.04.,55
19906,CONT_000000000500378,LJS,일몰장소 월일기준 일몰지고 깜깜할까봐 시분에 정상도착해서 시분쯤 내려왔는데 아쉬웠어요ㅠ 더보고올걸,kakao,5.0,22.12.08.,54
19953,CONT_000000000500378,Peter.J,산책하며 바라보는 바다풍경이 아주 좋습니다시원한 바닷바람이 더위를 가셔주네요주차장 무료,kakao,5.0,21.08.05.,48
19913,CONT_000000000500378,검은콩,여기는 시간내서 꼭 가야하는곳지인들 오면 무조건 데리고 가는곳단 한명도 불만이 없던곳,kakao,5.0,22.10.27.,47
19931,CONT_000000000500378,신밧드,둘레길 산책 좋아요 힘들지도 않고 난이도 하가파도 마라도도 보이고 말들도 많이 보여요,kakao,5.0,22.05.11.,47
19991,CONT_000000000500378,방실,이렇게 멋지고  아름다을수가 가슴이 뻥  빨리 정상 분화구도 개방이 되었으면 좋겠어요,kakao,5.0,20.10.08.,47
20001,CONT_000000000500378,쫌,아름다운 풍경이 너무 좋았어요 바람이 엄청나게 불었지만 그걸 감수하고도 너무 멋졌어요,kakao,5.0,20.04.07.,47
12071,CONT_000000000500376,jw, ,kakao,5.0,22.09.02.,1
12072,CONT_000000000500376,장원형, ,kakao,5.0,19.05.21.,1
12073,CONT_000000000500376,Ryu용환,제주 숨은비경 제주 민속문화재 제호 제주 무속 신앙의 메카 본향당의 원조,kakao,4.0,16.11.30.,40
6288,CONT_000000000500374,., ,kakao,5.0,22.02.06.,1
6287,CONT_000000000500374,은아짱,정상둘레길 한바퀴 돌 수 있고 동쪽 여러 오름을 볼 수 있어요 탐방로가 다른 유명한 오름보다 좋진 않지만 나름 매력있는 오름이예요 그러나 손지오름 표지석이 입구에서 조금 벗어난 곳에 세워져있어요,kakao,4.0,22.02.22.,108
6286,CONT_000000000500374,오르고또오름, ,kakao,4.0,22.12.10.,1
12490,CONT_000000000500373,sol,정방폭포에서 소정방폭포로 꼭 걸어가보세요 새소리를 써라운드로 가슴 설레는 길이 될거에요 좁고 구불구불한 길을 지나 탁 트이는 바다와 날 맞이해주는 소정방폭포 정말 고마웠어요  지금 시기가 딱 좋은거 같아요  한참을 폭포와 바다를 번갈아 보다가 다시 길위에 올라서서 조금만 걸으면 허니문 하우스 ㅎ ㅎ ㅎ 마치 요정의 궁전을 오려고 끝도 모르는 길을 걸었나 싶어집니다 당근케이크까지 접수하시면 스탬프 찍은거나 다름없어요 헤헤가는 여정이 정말 두근대요 폭포보다는 그 길이,kakao,5.0,19.06.19.,261
12471,CONT_000000000500373,ㅅㅊ,대정방폭포한테 밀려서 사람이 없어서 사진찍기도 좋음다만가는길이 여기가 맞나 싶을정도로 아무도 없는게 단점,kakao,5.0,22.06.06.,58
12477,CONT_000000000500373,오름오빠,정방폭포 보다는 작지만 가슴 뻥 뚫리는 시원함을 느끼기에는 충분함올레길 코스 걸으며 들리기 좋음,kakao,5.0,21.12.01.,53
12491,CONT_000000000500373,뱌뱌,예전에 왔을때 기억은 최고하지만 아직도 공사중 얼른 공사 끝내고 다시 멋진 소정방폭포 보고싶네요,kakao,5.0,19.03.24.,53
12476,CONT_000000000500373,강성현,해변이 이뻐요폭포 규모 차이때문에 소정방정방폭포 순으로 관람하는게 좋지 않을까 싶어요,kakao,5.0,22.01.15.,47
12463,CONT_000000000500373,ok차박 전국투어,차박 소정방폭포유튜브 검색하시면 동영상 올렸습니다 무료입니다  물맞이 행사도했습니다,kakao,5.0,22.11.04.,46
12478,CONT_000000000500373,Eum,허니문하우스에서 올레길 걷다가 우연히 다다른 곳작지만 아름다운 폭포와 시원한 파도,kakao,5.0,21.05.27.,45
12469,CONT_000000000500373,냠,무더운 여름날 칼호텔허니문하우스소정방폭포 올레길로 가볍게 걷기 좋아요,kakao,5.0,22.07.09.,38
12479,CONT_000000000500373,효로아,이름그대로 정방만큼은 거대하지 않지만 너무 예쁜 폭포,kakao,5.0,21.05.23.,29
12474,CONT_000000000500373,두렁이,가볍게 산책하기 너무 좋은곳뷰도 너무 좋았음ㅎㅎㅎ,kakao,5.0,22.02.03.,27
12467,CONT_000000000500373,버섯찌개,최고예요ㅎㅎㅎ 아무도 안와서 더 좋음,kakao,5.0,22.09.01.,20
12485,CONT_000000000500373,잠가루비,소정방이 앞 바다는 오늘도 이뻐요,kakao,5.0,20.10.18.,18
12472,CONT_000000000500373,고급진입맛,이런 인생샷을 건질수 있는곳,kakao,5.0,22.06.03.,15
12464,CONT_000000000500373,뺘뺘, 기준 못내려가게 막혀있음,kakao,5.0,22.10.19.,14
12487,CONT_000000000500373,별로,풍경 좋아요 쉬어가는곳힐링,kakao,5.0,20.04.14.,14
12468,CONT_000000000500373,뿌엥뿌엥,발 정도 담그기 좋음,kakao,5.0,22.08.03.,11
12465,CONT_000000000500373,바다, ,kakao,5.0,22.10.17.,1
12470,CONT_000000000500373,묭이, ,kakao,5.0,22.06.25.,1
12481,CONT_000000000500373,미지, ,kakao,5.0,21.03.26.,1
12483,CONT_000000000500373,flow, ,kakao,5.0,21.02.06.,1
12460,CONT_000000000500373,빛의 방랑자,자그만한 폭포인데정방폭포 반대편 작가의 길 그쪽으로 걸어가면 나옵니다정방폭포가 지겨워 방문했는데 나쁘지 않습니다무료,kakao,4.0,23.01.22.,64
12473,CONT_000000000500373,시욘세,여기 소정방 폭포에서 이어지는 작가의 산책길이 진짜 예쁨 칼호텔 까지  걸어가는 거 추천,kakao,4.0,22.04.11.,49
12462,CONT_000000000500373,맛집만 가는 사람,천천히 산책 하기 좋은 곳조금 걷다 보면 조그만한 폭포 나옴,kakao,4.0,22.11.28.,33
12480,CONT_000000000500373,김영광,산책길을 잘 만들어놔서 아이들도 쉽게 갈 수 있을거 같아요,kakao,4.0,21.04.09.,32
12475,CONT_000000000500373,연필깍이,가는길이 좀 무서워요 ㅜ ㅋㅋ 애기데리고는 안가시는게,kakao,4.0,22.02.01.,29
12482,CONT_000000000500373,엉엉,정방폭포 매표소에 사람이 많아서 우연히 들른곳무료,kakao,4.0,21.02.14.,27
12461,CONT_000000000500373,썬~*,이틀 일찍 와서 못보고 가네요 ㅠㅠ 내년에 보자,kakao,4.0,22.12.06.,26
12493,CONT_000000000500373,☆,조금 아쉽지만 좋아요,kakao,4.0,18.01.25.,11
12484,CONT_000000000500373,반달,정방폭포보다 작은 정방폭포폭포는 너무작아 폭포인지도 모르고 봤지만 바다쪽은 아름다워요,kakao,3.0,21.01.14.,47
12489,CONT_000000000500373,종하니,올레길로 와서 몸식히고 가면 진짜 좋음,kakao,3.0,19.07.26.,21
12492,CONT_000000000500373,와와,난간 보수 공사한다고 출입 통제 중임,kakao,3.0,19.01.09.,20
12486,CONT_000000000500373,ㄲ, ,kakao,3.0,20.05.01.,1
12488,CONT_000000000500373,깜,폭포는 인공적느낌이 강한데대신 앞바다 풍경이 좋다,kakao,2.0,19.11.24.,27
12494,CONT_000000000500373,인선,외져서 혼자가기는 위험해보여요,kakao,2.0,16.03.20.,16
12466,CONT_000000000500373,TatianaN, ,kakao,1.0,22.09.26.,1
6702,CONT_000000000500372,happy day~!,아드님이 좋아하는 세계 랜드마크가 다 있는곳또 왔어요 세계여행을 못가니하지만 저는 요기 기념품 판매점때문에와요 다른곳보다 정말 저렴합니다 특히 핸드크림초콜릿등 이것저것 고르다보니 아드님에게 서비스를 잔뜩주셨네요 감사합니다아들이 또 가자고 안해도 선물사러 갈꺼예요근처에 고기집도 가야하고흑돈시백돈면,kakao,5.0,22.01.11.,165
6701,CONT_000000000500372,루와젠,기대를 너어무 안 하고 가서 그런지 좋았어욬ㅋㅋㅋ 해외를 가기 힘든 요즘 시국에 기분 전환 삼아 가기 좋은 것 같아요,kakao,5.0,22.01.18.,65
6705,CONT_000000000500372,Transport trip,아이들과 가면 좋은 곳 안내도 잘 되어 있어서 교육에도 좋고 그 나라 특징을 잘 살려 전시해 놓았음,kakao,5.0,21.09.16.,55
6723,CONT_000000000500372,심유진,재밌어요 볼거리가 많아요근데 너무 많아서 나중에는 그냥 패쓰ㅎ그래도 사진 찍으면서 즐기면 재밌어요,kakao,5.0,20.02.13.,54
6697,CONT_000000000500372,반부호,아이들과 즐거운 시간 보냈어요 긴 시간 가지고 여유 있게 보면 좋을 듯,kakao,5.0,22.08.16.,39
6693,CONT_000000000500372,이성민,다 좋은데 열차는  너무 재미있고 좋아요  꼭 타보세요,kakao,5.0,23.01.31.,30
6708,CONT_000000000500372,그렇군요,추천드립니다 아기자기해요 ㅎㅎ,kakao,5.0,21.08.23.,16
6716,CONT_000000000500372,사이타마끼,좋아용 예쁘고 귀엽고,kakao,5.0,20.10.01.,11
6721,CONT_000000000500372,김해린,아기자기하고 귀여워요,kakao,5.0,20.04.20.,11
6698,CONT_000000000500372,김효진,쉴곳도많구 만족,kakao,5.0,22.07.16.,8
6704,CONT_000000000500372,Hasan,    ,kakao,5.0,21.09.22.,4
6715,CONT_000000000500372,카렌 🍁,  ,kakao,5.0,21.02.14.,2
6699,CONT_000000000500372,전연화, ,kakao,5.0,22.04.29.,1
6700,CONT_000000000500372,이용빈, ,kakao,5.0,22.01.30.,1
6706,CONT_000000000500372,맛있는거찾자, ,kakao,5.0,21.08.26.,1
6709,CONT_000000000500372,개개개개개, ,kakao,5.0,21.07.12.,1
6710,CONT_000000000500372,꾸약암 깜순이 깜뚱이, ,kakao,5.0,21.07.12.,1
6712,CONT_000000000500372,투민사랑, ,kakao,5.0,21.06.10.,1
6711,CONT_000000000500372,프로가되자,년전까지만 해도 제주에서 북적대고 인기많던곳들중 하나인데제주아이들 소풍코스기도 하고테지움 사파리도 그렇고 여기도 그렇고 낡고 시간이 흘르고 시대에 따라가지 못해 기울어져 간다는 느낌,kakao,4.0,21.06.20.,101
6695,CONT_000000000500372,Yeon,가족여행으로 너무 좋은코스이지만 입장객이 많지않아서인지 중간 쉼터에 카페는 운영하지 않네요ㅠㅠ 그래도 중간중간 쉼터있고 좋습니다,kakao,4.0,22.08.31.,71
6726,CONT_000000000500372,샤크,나름 나뿌지 않았네요 년만의 제주도 여행  근데 가을 장마가ㅠㅠ,kakao,4.0,19.08.27.,35
6707,CONT_000000000500372,이상호,한번은 갈만합니다평일 천원에 한시간에서 한시간정도 돈것같네요,kakao,4.0,21.08.24.,33
6713,CONT_000000000500372,놀래말래, ,kakao,4.0,21.06.08.,1
6717,CONT_000000000500372,슈크레, ,kakao,4.0,20.09.30.,1
6720,CONT_000000000500372,강기훈, ,kakao,4.0,20.05.24.,1
