,ID,WRITER,CONTENT,TYPE,SCORE,CREATED_AT,len_content
18047,CNTS_200000000014386,민호,좋아요아주 좋아요후회는 접근 못함오로지 향수만이 남을곳,kakao,5.0,20.07.12.,30
18027,CNTS_200000000014386,01837,한 바퀴 산책하면서산방산도 보고마라도도 보고좋더라구요,kakao,5.0,21.03.16.,29
18005,CNTS_200000000014386,ㅇㄹ,걷는데 힘들이지 않고 최고의 경치를 맛볼 수있다,kakao,5.0,22.06.04.,26
18052,CNTS_200000000014386,찌니,어두울때가서 ㅜㅜ 그래도 너무 좋아요 산책하기,kakao,5.0,19.11.22.,25
18011,CNTS_200000000014386,오빠믿지?,맑았던 날씨와 대조되는 강풍경치는 완전예뻐요,kakao,5.0,22.02.19.,24
18014,CNTS_200000000014386,제주 이야기,바다를 보며 걷는 둘레길 경치가 장관이다,kakao,5.0,21.11.17.,22
18020,CNTS_200000000014386,고구마,예뻐요 걷기도 좋구 정말 자연 아름다워요,kakao,5.0,21.07.24.,22
18040,CNTS_200000000014386,시택,바다 경관이 아주 좋고 산책로도 좋습니다,kakao,5.0,20.10.28.,22
7005,CNTS_200000000014318,해포,시설도 깨끗하고 너무 친절하네요,kakao,5.0,21.10.31.,17
7004,CNTS_200000000014318,주주, ,kakao,5.0,22.03.31.,1
3371,CNTS_200000000014307,백윤주,고양이랑 강아지를 같이 키우다보니 둘 다 맡길 수 있는 미용실이 필요했는데 딱이에요여기 미용사님 실력좋아요고양이도 무마취로 해주시고강아지들 예뻐하는게 느껴집니다사근사근한 성격은 아니시지만 친절해요,kakao,5.0,20.12.16.,109
3372,CNTS_200000000014307,오태윤,이 집 미용 잘 하네,kakao,5.0,20.03.01.,11
3470,CNTS_200000000014306,석은주,애견미용 너무 잘해요너무 만족스러운곳이에요,kakao,5.0,20.04.12.,23
106,CNTS_200000000014302,haruya,너무 좋은데 후기가 없어서 남겨요제주에 내려 온 이후로 일정하게 다니는 곳은 없었고근처에 비교적 예약이 빨리 되는 곳에가서 미용을 했었어요 최근 미용했던 샵이 너무 실망스러워서검색하다가 쿠키네를 방문하게됐고이전에 다녔던 곳들보다 너무 예쁘게 잘해주셔서 만족스러웠습니다가격도 다른 곳보다 만원이나 더 저렴최근에 생겨서 그런지 매장도 깔끔 청결미용 후 챙겨주시는 간식도 감사하게 잘 먹였습니다앞으론 여기로 정착이에요,kakao,5.0,22.07.31.,230
53,CNTS_200000000014289,제주도민,개월 아기랑 살 비숑아이랑 방문했어요아기 분유 데워달라고 부탁드렸는데 친절하게 해주셔서 너무 감사했습니다실내공간도 매우 쾌적하고 바깥 운동장도 인조잔디라 아이들 발이 더럽지 않아서 좋아요다른 강아지들도 다들 매너가 좋았어요아기 임신해서 코로나때문에 애카를 거의 년동안 못 다녔는데 오랜만에 가니 저희 강아지가 너무 좋아했어요 집에 와서 기절했네요자주 방문할게요,kakao,5.0,22.09.18.,201
54,CNTS_200000000014289,u,비오는 날인데 실내가 넓어서 잘 놀다왔어요,kakao,5.0,22.06.05.,23
55,CNTS_200000000014289,김민경,처음에 물어보러 들어갔더니 사장님은 관심도 없고 아줌마분들이 전세내고 쓰는 느낌이라 들어가기 거북해서 편하게 못있었음,kakao,1.0,22.05.24.,65
4,CNTS_200000000014285,kbh,별이랑 달이는 사회성이 없어서 카페에  적응을  못했는데 러블리독스에서는 신기하게 잘지내네요 짖음이 있기는 한데 사장님이 이해해 주셔어 마음 편히 놀고 왔어요 상주견들도 너무 성격이 좋고 귀엽떠라구요감사합니다,kakao,5.0,22.07.18.,116
7,CNTS_200000000014285,bbmaly,너무 재미있게 놀다왔어요아아도 맛있고강아지들도 진짜 인형처럼 귀여웠고일하시는분들도 친절하고 편하게 맞아주셔서 감사했어요저처럼 강아지 좋아하는데 형편상 키우진못하는 사람들도 오면 재밌으실거에요 별다섯개드립니둥,kakao,5.0,22.07.07.,115
5,CNTS_200000000014285,ywj,카페가 아주 깨끗하고 좋았어요 생일 잔치가 있어요 조금 복잡하긴 했지만 가족 같은 분위기였어요 직원분도 친절하고 강아지를 잘 돌보더라구요음료가 아주 다양한건 아니지만 키위주스 맛있게 먹고 왔습니당,kakao,5.0,22.07.16.,109
3,CNTS_200000000014285,RINA,밖에 운동장 자주 이용합니다 넓고 애들 뛰어놀기 너무좋아요 실내에서 강아지들이 다같이 어울려서 친해지기 좋은 분위기에요커피도 시원하게 마시면서 애들도 재밌게 놀아주니 자주 이용할게요,kakao,5.0,22.07.29.,101
6,CNTS_200000000014285,EJ,사장님이랑 직원분이 너무 친절하고 강아지들 한테도 진정성이 보여서 너무좋았어요카페도 너무 이쁘고 냄새도 않나요 다음에 또 와야겠어요,kakao,5.0,22.07.14.,73
1,CNTS_200000000014285,뚜비두밥,사장님 친절하시고 제주 놀러와서 아들래미 잠깐 맡겼는데 영상도 카톡으로 보내주시고 저렴하고 좋아요 다음에 또 이용할게요 ,kakao,5.0,22.09.15.,67
2,CNTS_200000000014285,김효선,카페가 깔끔하고 야외정원도 있어 이용하기 편했어요 다음에 또 방문하고 싶네요,kakao,5.0,22.09.12.,42
8,CNTS_200000000014285,한누리,실내공간에도 야외로 연결되어 있어서 좋았어요 ㅎㅎ 사장님도 친절하세요 ,kakao,5.0,22.07.04.,39
0,CNTS_200000000014285,고구마,여기 가보고애들 많이 가는 애견카페에 반려견 맡기면 안되겠구나 생각함부모님들 왜 아이가 약한 강아지 번쩍번쩍 들어서 위협하는데 제지 안하고 가만 두시는지,kakao,3.0,22.09.16.,85
9,CNTS_200000000014285,ㅇㅅㅇ,음료 맛없음강아지는 놀만해요,kakao,2.0,21.09.26.,15
5513,CNTS_200000000014284,Kalamış,깔끔하고 좋아요,kakao,5.0,22.08.17.,8
5516,CNTS_200000000014284,♥꼬물이♥, 멍더랜드 짱 ,kakao,5.0,22.07.15.,8
5514,CNTS_200000000014284,아아어어,최공 ,kakao,5.0,22.08.13.,3
5515,CNTS_200000000014284,고무치, ,kakao,5.0,22.07.24.,1
5512,CNTS_200000000014284,🐶,강아지 대해 물어봤더니 직원들은 개인케어는 못 한다고 말하고 강아지 대해 잘 모르는것같애요 직원이 그렇게 말 하는게 말이 되나 싶네요공짜도 아니고 돈 내고 맡겼는데다른 주인께서 들었는데 여기 맡기고 탈출 한 강아지 있다고 하네요바로 앞에 차가 많이 지나갔는데 너무 소름이요소중한 가족이라면 맡기지마세요,kakao,1.0,23.01.26.,168
5517,CNTS_200000000014284,ㅉㅎ,최악 ,kakao,1.0,21.12.21.,3
21,CNTS_200000000014283,추추,사장님도 너무 친절하시고 강아지들놀기에도 좋아요 ㅎㅎㅎㅎ주말에는 다양한 견종들도 모여서 같이뛰어놀면서 아가들이 좋아하네요약간 사회성이 부족하거나 예민한강아지들이 있으면 목줄착용을 권해주셔서다른 견주들도 마음 편하게 풀어놓고놀게 할 수 있어서 좋네요하지만 가끔 어린 아이들이와서 강아지들보고 놀라 소리지르는경우가 있는데이부분은 부모님이 애견카페 오기전에꼭 주의를 해줘야하는 부분같네요그래도 저희 강아지가 너무 좋아하고집도 가까워 자주 애용합니다,kakao,5.0,21.04.25.,247
19,CNTS_200000000014283,기리,사장님이 강아지 케어 잘해주시네요 한번은 흥분해서 다른강아지를 물려는문제있는 개를 계속 지켜보며 케어하시는 단호하게 다른강아지를 위해 목줄하게  하시고 끝까지 지켜보고 케어하시는 모습에 너무 좋았습니다 가게도 깔끔하고 요즘 자줏가는데 저희 강아지가 참좋아하는 모습이 저까지 행복하네요 번창하시길,kakao,5.0,21.05.14.,164
20,CNTS_200000000014283,아그아그,완전 단골 예약입니다사장님이 강아지를 세심하게 봐 주시고강아지 문제에 대해서 조언도 해주셔서 너무 좋았어요강아지 기절 예약 입니다,kakao,5.0,21.05.13.,72
18,CNTS_200000000014283,망고,위치도 노형권이라 너무 좋았고 특히 실내외 두공간 이용할수 있어서 더욱 좋았어요그리고 사장님 완전 짱친절,kakao,5.0,21.05.21.,58
17,CNTS_200000000014283,멍,기대하며 방문했지만 실망함  음료는 괜찮았음,kakao,1.0,21.08.16.,24
6951,CNTS_200000000014279,..., ,kakao,5.0,22.11.22.,1
58,CNTS_200000000014276,ys,사장님들께서 강아지를 사랑하시는게 느껴집니다 잔디밭에서 놀고 목욕도 시키고 올 수 있어 좋아요,kakao,5.0,22.05.14.,52
56,CNTS_200000000014276,민아,제주에 이만한 소형견전용운동장이있을까욥최고입니댜,kakao,5.0,22.07.04.,26
59,CNTS_200000000014276,yeahyeap, ,kakao,2.0,20.10.04.,1
57,CNTS_200000000014276,클로이,할말하않,kakao,1.0,22.05.24.,4
25,CNTS_200000000014275,♥꼬물이♥,유치원 호텔링 목욕 모두 너무 만족사진 하루 두 세 번 수십장씩 보내주세요나는 집에서 멀어서 자주 이용은 못하지만강추강추,kakao,5.0,21.10.05.,67
24,CNTS_200000000014275,송호응,음 중성화 시키신 분들만 제가 잘못 본 걸 수도 있지만 관리 잘 안됐음산책하다가 봄  두마리가 쌤으로 보이시는분이 다른 애들 챙길때 교배하는거 보고 충격 딴 곳 많으니 고민후 이용하시길,kakao,3.0,22.12.25.,103
107,CNTS_200000000014273,심수지,사장님들 너무 친절하시고 멍멍이들 케어도 정말 잘해주세요 막둥이가 유치원 가는 걸 정말 좋아하거든요 그것만 봐도 사장님들께서 얼마나 사랑과 정성으로 곱닥이들 돌봐주시는지 알 수 있더라고요,kakao,5.0,22.01.22.,104
108,CNTS_200000000014273,닌마,친절하고 체계적입니다유치원이용중인데울 아가가 스트레스 안받고 친구들하고 잘지냅니다  늘감사합니다,kakao,5.0,20.09.29.,53
460,CNTS_200000000014272,ㅇㅇ,호텔링 맡기지마세요 호텔링하는 애들 관리 안하고 밤새 애들이 짖어요 인스타보니 가정케어한다고 적혀있던데 케이지도 없이 몇마리든 그냥 매장에 풀어놓고 재워요 호텔링을 잘하고 있으면 인스타에도 호텔링하는거 올릴텐데 호텔링 사진 하나 없이 미용한 애들 사진만 올려둔것만 봐도 답 나오네요 안에 애들 있는데 가게 문 닫혀있을때도 많아요 최악,kakao,1.0,23.01.10.,186
463,CNTS_200000000014272,YELLKY,제시된 금액과는 터무니 없는 금액은 제시하질 않나 안그래도 아이미용 스트레스 받는거 누구보다더 잘 알텐데 그저 큰소리지르고 아이가 낑낑 거려도 아래글처럼 달래기는 커녕 오히려 더 세게 뭐라하던데 사람이 옆에 있어도 이정도인데 과연 아무도 없을땐 어쩔지 정말 노답인곳,kakao,1.0,21.05.10.,148
461,CNTS_200000000014272,강정토박이,인스타에 낚여 갔다가 ㅅㄱ 당했네요 후기 다 뭐임,kakao,1.0,22.11.03.,27
462,CNTS_200000000014272,하이,이젠 안가야겠다 믿지못하겠네,kakao,1.0,22.08.31.,15
7095,CNTS_200000000014189,선,리뷰를 보니 호불호가 꽤 갈리면서 볼 게 없다는 소리도 있던데 이해가 가질 않네요 저는 꼼꼼하게 돌아다니니 거의 시간이 걸렸고 여기가 명소 만물상이라고 생각이 들 정도로 정말 다양하게 구색을 갖췄다고 생각했습니다 마치 여기를 디자인하고 꾸민 사람이 제주의 온갖 명소를 다니면서 좋다 싶은 건 다 가져온 느낌 다만 다양한 꽃과 나무가 있어서 때가 안 맞아 개화시기가 맞지 않으면 그렇게 느낄지도 모르겠습니다 그러니 가기 전에 지금 어떤 상태인지 확실히 알아보고 가세요 작년 월 말에 갔을 때는 온갖 꽃과 나무 많은 포토존 앤틱 실내공간 작은 성당 여러 종류의 동물 등 정말 다양하게 있었습니다 특히 그때 다른 곳은 수국이 다 졌는데 여기는 그렇지 않아서 신기했네요 관리자분에게 물어보니 종이 좀 달라서 그렇다고 들었습니다 이제 곧 수국철이니 추천합니다,kakao,5.0,22.06.05.,419
7106,CNTS_200000000014189,나그네,하루 종일 전화를 안 받으셔서 문 닫은 줄 았았는데 막상 가보니 가성비 좋은 장소였습니다 네이버나 티몬 예약으로 천원대에 결제하였는데 그 이상의 값어치는 하는 곳이었습니다 강아지 공작새 말 염소 양 토끼 등 동물들도 많고 동백꽃밭 등 포토존이 여러 곳 있었습니다 무엇보다 사람들이 잘 모르는 곳 같아서 한적하게 다녀올 수 있었습니다,kakao,5.0,21.02.03.,185
7124,CNTS_200000000014189,기분좋은 고양이,지금은 입장료 만원인데 그래도 가치있는곳입니다인스타 이벤트 참여하면 계란귤도 주고 포토존에서 인생샷엄청 남길수 있어요 무료대여해주는 귤모자가 인기폭발이라 있을때 써야해요 없어도 금방 다시 생기니까 꼭 쓰고 찍어요 귤도 존맛이고 키로 가져갈수 있어요글고 여기에 당나귀가 있는데 사람을 엄청 좋아합니다 다가가기만해도 알아서 와요,kakao,5.0,19.11.30.,181
7099,CNTS_200000000014189,구자윤,가성비 아주 좋아요 사장님 이하 매표소 직원분들 아주 아주 친절하시구요 아이들 먹이체험 사진찍기로 이만한곳도 없을거 같아요 아쉬운점 하나를 꼽자면 청소가 잘 안되어서 저는 번방문 했는데 방문할때마다 냄새가 많이 났어요 청소만 조금 신경쓰신다면 아이들과 시간보내고 사진찍기에 제주에서 몇안되는 가성비좋은 명소가 될듯합니다,kakao,5.0,22.01.07.,178
7100,CNTS_200000000014189,YR,카멜리아힐 가다가 귤이나 따려고 들어왔는데 땡잡았어요 사람도 별로 없어서 동백사진도 많이찍고 동백꽃이 넘 예쁘게 잘되어 있어요 사진찍으려고 기다릴 필요도 없구요 귤도 따고 동물도 보고 사진도 많이찍고 갑니다 저는 아기랑 같이가서 만족했어요,kakao,5.0,21.12.24.,133
7110,CNTS_200000000014189,남경일,동물들이 진짜 사람들을 너무 잘따라요 관리가 잘됐고 포토존도 많아서 보기 좋았어요 직원들 친절하고 안내도 정말 잘해주셨어요 귤이 너무 맛있고 탐스럽게 열렸어요 너무 재밌게 놀다가요 다음에 또 올께요 ,kakao,5.0,20.12.12.,111
7125,CNTS_200000000014189,혼자잘댕김,천원내고 귤 무한으로 먹고 인생사진 남기고 그냥 나만의 핫플 그 자체 귤모자 무료 대여고 직원분도 친절해요 귤 체험 여기가 짱인듯 합니다,kakao,5.0,19.11.08.,76
7111,CNTS_200000000014189,이수진,기대안하고갔는데 사장님도 친절하시고 소품도 챙겨놓으시고 포토존도있어요 핑크뮬리도 있구 동물들도 있어서 좋앙ㅅ,kakao,5.0,20.11.11.,60
7087,CNTS_200000000014189,스슴,년 월패스권 이용함귤무한시식도 되어 좋음시식만 됨인에 가위 개줌근데 손으로 따도 됨전체적으로 좋았음,kakao,5.0,22.11.23.,55
7107,CNTS_200000000014189,.,여기 너무 꿀잼 볼 거 많구 감귤밭에서 인생사진 찍었어요동물들 너무 무서워욬ㄱㅋㄱㅋㅋ 특히 타조,kakao,5.0,21.01.19.,53
7104,CNTS_200000000014189,초콜렛,여기 왜안유명한지 모르겠네요 깨끗하고 동물도많고 아기자기하게 포토스팟에 넘잘다녀왔어요,kakao,5.0,21.05.06.,47
7109,CNTS_200000000014189,꽥꽥🐤,음료도 너무 맛있고 사장님이 너무 친절하세요 공간도 예쁘게 잘 꾸며져있어요,kakao,5.0,20.12.16.,41
7115,CNTS_200000000014189,윤지원,갑오브더갑이예요동백도 보고 동물도보고 귤체험도있고완전 다양해욧,kakao,5.0,20.09.17.,34
7105,CNTS_200000000014189,마무라,재미있어요 하지만 조금 청소 잘 해야돼요,kakao,5.0,21.03.21.,22
7088,CNTS_200000000014189,李旼靜, ,kakao,5.0,22.11.09.,1
7103,CNTS_200000000014189,투민사랑, ,kakao,5.0,21.06.10.,1
7114,CNTS_200000000014189,이창순,표지판 있을만큼 있고 헤맬 정도로 드넓지도 않습니다 좀 낡은 티는 나는데 그래도 두세살 아이들 엄청 좋아합니다 당근 한컵에 천원이라 혜자고요 동물들 그렇게 불쌍해보이지도 않습니다 건초 사료 다 잘 먹이시던데 당근 보면 달려드는 거야 원래 동물들이 그렇죠 반나절 잘 놀고 갑니다,kakao,4.0,20.10.11.,154
7122,CNTS_200000000014189,운정맛집러,귤따고 동백꽃 구경하기 좋음 ㅋㅋㅋ 엄청난 동백꽃은 아니지만 ㅋㅋㅋ두개 다 적당히 하고 싶은 분들에게 추천 ㅋㅋㅋ 그리고 동물 구경도 가능하고 당근 먹이 주는것도 가능해서아이들 있으신 가족은 여기 괜찮을것 같음 다만 동백 인생샷 찍어야 한다면 비추 꽃이 많이 없음 ㅠㅠ,kakao,4.0,20.01.07.,150
7112,CNTS_200000000014189,seachj71,동물먹이체험 귤따기체험  여러테마정원 배경사진찍기 등 아이들과 유익한 시간을 보낼 수 있었네요먹이체험시 알파카 침뱉기 조심은 팁 ㅎ귤은 양껏 따서 먹고 정해진 봉지에 따서 담아 오고 일부는 주머니 활용 이정도면 가성비좋고 재미지고 일석이조,kakao,4.0,20.11.03.,133
7120,CNTS_200000000014189,Hyperion,지난 주말에 다녀왔는데 시설들은 아기자기 괜찮았네요근데 간 날 바람이 너무 세고 추웠는데 입구에 강아지들이 자기들끼리 가까이 모여서 웅크리고 있는 모습이 너무 안쓰러웠습니다 야외에 칼바람 부는데 낡은 이불같은거라도 좀 줬으면 싶네요,kakao,4.0,20.01.24.,129
7121,CNTS_200000000014189,jmmm,동백은 카리아 힐보다 많고 예쁜듯 ㅋㅋ사장님이 엄청 친절하시고 한군데서 다양한 체험을 할 수 있다는 점에서 아이 동반 가족 방문을 추천합니다귤도 맛있어요 많진 않지만 농장 구석구석에 아직 귤이 좀 있어요,kakao,4.0,20.01.23.,113
7113,CNTS_200000000014189,hyo♥,점점 꾸며지고 있음  아이들데리고 동백포토스팟 귤따기 동물 한꺼번에 끝내기 좋겠음 겨울에 동백군락이 볼 만할 것 같은 느낌 뿜뿜 지금은 열심히 가꾸고 계시는 중,kakao,4.0,20.10.26.,89
7089,CNTS_200000000014189,오경석,제주패스로 가시는분들은 패스권 쓰시면 시식밖에 안됩니다 키로 봉투에 원 추가구매해야하니 참고하세요 그래도 귤이 좋아서 그정도 가치는 있음,kakao,4.0,22.11.05.,76
7098,CNTS_200000000014189,가성비 여행자,끝물이라 귤은 많이 없지만 신선하고 맛있음동백숲 팜파스 등지에서 사진 찍기 좋음동물 먹이 주기가 있어 아이가 있으면 추천함,kakao,4.0,22.01.21.,68
7086,CNTS_200000000014189,둥둥,귤 맛집  동백꽃 맛집  동물들 때문에 별한개 깎음,kakao,4.0,22.12.14.,28
7108,CNTS_200000000014189,RedLine,동물친구들이 귀여웠어요,kakao,4.0,20.12.21.,12
7119,CNTS_200000000014189,♧달달하이♧,알파카랑 타조도 있고 귀여운 애기 멍멍이두 있어요 염소 오리 토끼 당나귀 사슴 등등 참신하구 재미있긴한데 동물들 불쌍해서 점수 뺍니다 애기 멍멍이들이 너무 처절하게 울어서 맘아팠음 ㅜㅠ,kakao,3.0,20.02.21.,103
7090,CNTS_200000000014189,한끼,감귤체험은 잘 했으나 동물들은 좀 더 좋은 환경이였으면 합니다 다들 흙바닥에 가둬놓기만 해둔거 특히 시바견을 그렇게 방치해둔걸 보니 죄책감이 들어요,kakao,3.0,22.10.10.,82
7123,CNTS_200000000014189,선리,귤 바로 따먹으니까 맛이 다르네요 진짜 맛있어요동물들의 먹이나 물이 관리가 잘 안되어있는 것 같아서 좀 아쉬웠습니다,kakao,3.0,20.01.03.,64
7097,CNTS_200000000014189,soon,패스권 입장 정상가로 들어왔으면 아쉬웠을거에요 한시간 잘 놀다 가요 잘 관리된 느낌은 아닙니다,kakao,3.0,22.01.26.,52
7092,CNTS_200000000014189,빵돌이, ,kakao,3.0,22.08.05.,1
7117,CNTS_200000000014189,헐랭방구,직원분은 친절하세요 유리온실은 파파야 바나나나무가 전부이고 귤 철이 아니고 동백철이 아니여서 식물원은 볼게 없었어요 동물들은 종류가 많았는데 관리가 잘 안되있어요 넉넉한 우리는 못만들어주더라도 깨끗한 환경을 만들어주면 좋겠어요 강아지도 꾸질꾸질 양은 간지러운지 벽에 몸을 긁고 맴찢입니다ㅠㅠ,kakao,2.0,20.05.16.,162
7093,CNTS_200000000014189,두무,안내표지판이 없어서 드넓은 땅을 헛걸음 하기 일쑤이고 시설이 너무 낙후되어 있습니다 유리온실은 들어가보니 창고라며 직원이 나가라네요 타조 당나귀 사슴 토끼 모두 먹이를못먹어서 사람만 보면 달려드네요 뱃가죽이 다 말랐었어요 돈내고 들어온 제가 미안할 정도였습니다 제발 폐지돼서 동물들이 자유로워 지면 좋겠네요,kakao,1.0,22.07.03.,171
7085,CNTS_200000000014189,지프,여기 왜 돈주고 왓나온 내가 바보죠관리도엉망에 입장료내고체험비내고동물먹이는 또 사야하고 동물 관리는 완전엉망불쌍해요저번에갔던 감귤밭동물농장이랑 너무 차이가나네요거긴 카페만 이용하면 동물구경이랑 먹이체험도 다 무료였는데인형탈도 너무 더러웠네요불쾌했어요,kakao,1.0,23.01.10.,139
7116,CNTS_200000000014189,neoll,정원 잘 가꾸신건 알겠는데입장료 비싸고지나다 우연히갔는데 동물들도 있는줄 몰랐네요동물사육장은청결하지 않아 보이고 좁고목줄을 달아놓은ㅡㅡ동물들이 불쌍해요,kakao,1.0,20.08.10.,84
99,CNTS_200000000014088,어서옵,넓고 큰 대형 카페 생강라떼가 진짜 진하고 맛있다 너무 진해서 매울정도 날씨가 추운 날이었는데 덕분에 감기룰 이겨냈다 사장님도 친절하시고 밑에는 재밌는 아트 클래스를 진행하던데 다음번에 이용해보고싶음,kakao,5.0,22.03.09.,111
95,CNTS_200000000014088,구리멍,우연히 발견했는데 최고입니다와인 친절하게 설명해주시고 테이스팅 도와주신여직원분 여사장님 정말정말 친절하세요와인 사마시는 가격에 전시회도 구경한 느낌이에요진짜진짜 요긴 꼭 가보셔야합니다,kakao,5.0,22.05.20.,102
92,CNTS_200000000014088,Lucy,커피랑 베이커리 다 맛있어요 가격도 합리적 거기에 바다뷰까지 진짜 좋네요 생긴지 얼마 안돼서 온게 얼마나 다행인지 ㅎㅎ 조만간 애월 핫플 될거 같은 느낌 ㅎ,kakao,5.0,22.07.21.,87
89,CNTS_200000000014088,이서,디저트도 너무 맛있고 음료도 괜찮아요  자리가 너무 편하고 공간도 갬성 장난 아님니다ㅋㅋㅋㅋㅋㅋ 작품들이랑 가구들로 잘 꾸며져 있어서 사진도 잘나와여,kakao,5.0,22.09.03.,83
93,CNTS_200000000014088,Jin,감동 받고 갑니다 로컬에게 추천 받은 얼마 지은 지 안된 카페인데 제주 최애 카페로 등극ㅜㅜ,kakao,5.0,22.06.04.,51
97,CNTS_200000000014088,ssippol,여기 진짜 예쁘고 좋아요,kakao,5.0,22.03.26.,13
100,CNTS_200000000014088,김동훈,분위기 좋고 너무 이뻐요,kakao,5.0,22.03.06.,13
91,CNTS_200000000014088,콩콩,자리도 넓고 짱 이뻐요,kakao,5.0,22.08.04.,12
90,CNTS_200000000014088,!,분위기 맛집,kakao,5.0,22.08.09.,6
96,CNTS_200000000014088,냠냠쩝쩝화이팅, ,kakao,5.0,22.05.02.,1
101,CNTS_200000000014088,양팔통, ,kakao,5.0,22.03.05.,1
98,CNTS_200000000014088,지혜,아이슈페너 진짜 맛있는데 레몬에이드는 왜 베스트메뉴인지 모르겠어요ㅜㅜ 넘 달고 셔서 ㅠ 아쉬었습니다 카페 분위기는 미술관같고 넘 좋아요 재방문의사 있습니다,kakao,4.0,22.03.22.,86
94,CNTS_200000000014088,보물찾기,노출 콘크리트 인테리어로 되어 있어서 좀 오래 있으면 머리가 아파요 경치가 좋아 오래 있고 싶은 데 아쉽네요 커피도 특별히 맛있지는 않아요,kakao,2.0,22.06.03.,77
13957,CNTS_200000000014087,ʜᴀɴ,이름처럼 별이 아주 잘 보이는 곳이라 밤에 해먹에 누워서 별 보고 있을때 가장 좋았어요수영장도 넓고 깨끗해서 좋았고스타키퍼 분들 모두 친절해서 감사했습니다아침에 햇빛 받으며 마당에서 조식 먹을 때 진짜 기분 좋아요다만 여기가 한라산 안에 있는 곳이라 흡연자 분들은 흡연하려면 스타빌에서 나가서 산 아래로 내려가셔야해요 ㅋㅋㅋ,kakao,5.0,22.11.04.,181
13959,CNTS_200000000014087,감꽃,럭셔리 글램핑에 끝판왕 연주회 굿,kakao,5.0,22.10.11.,18
13960,CNTS_200000000014087,각자도생,돈은 거짓말을 하지 않습니다,kakao,5.0,22.05.20.,15
13958,CNTS_200000000014087,산 중달,좋아요 그냥 좋아요,kakao,5.0,22.10.14.,10
13962,CNTS_200000000014087,박한이,매우 기대됩니다,kakao,5.0,21.05.14.,8
13961,CNTS_200000000014087,소통,럭셔리 글램핑,kakao,5.0,21.06.16.,7
13963,CNTS_200000000014087,김성희,최고예요,kakao,5.0,21.04.08.,4
13956,CNTS_200000000014087,ak, ,kakao,5.0,22.12.11.,1
